{
  "schema_version": "1.0.0",
  "generated_at": "2026-06-12T08:05:00Z",
  "cadence_s": 60,
  "clocks": {
    "sun_imagery_at": "2026-06-12T07:49:00Z",
    "l1_measured_at": "2026-06-12T08:04:00Z",
    "model_run_at": "2026-06-12T06:00:00Z"
  },
  "sources": {
    "swpc_plasma": { "status": "ok", "last_success_at": "2026-06-12T08:04:30Z", "age_s": 30 },
    "swpc_mag": { "status": "ok", "last_success_at": "2026-06-12T08:04:30Z", "age_s": 30 },
    "swpc_indices": { "status": "ok", "last_success_at": "2026-06-12T08:00:10Z", "age_s": 290 },
    "ovation": { "status": "ok", "last_success_at": "2026-06-12T08:01:00Z", "age_s": 240 },
    "donki": { "status": "ok", "last_success_at": "2026-06-12T07:50:00Z", "age_s": 900 },
    "goes_csm": { "status": "ok", "last_success_at": "2026-06-12T07:55:00Z", "age_s": 600 },
    "sdo_imagery": { "status": "ok", "last_success_at": "2026-06-12T07:49:00Z", "age_s": 960 }
  },
  "solar_wind": {
    "measured_at": "2026-06-12T08:04:00Z",
    "spacecraft": "DSCOVR",
    "speed_kms": 720.0,
    "density_pcc": 18.5,
    "temperature_k": 410000,
    "bt_nt": 21.0,
    "bx_gsm_nt": -3.0,
    "by_gsm_nt": 6.2,
    "bz_gsm_nt": -17.4,
    "series": {
      "t_unix": [1781250240, 1781250300, 1781250360, 1781250420, 1781250480, 1781250540],
      "speed_kms": [705.0, 712.0, 718.5, 716.0, 722.0, 720.0],
      "bz_gsm_nt": [-14.2, -15.8, -16.5, -17.0, -17.8, -17.4],
      "density_pcc": [16.0, 17.2, 18.0, 18.8, 18.2, 18.5]
    }
  },
  "l1_to_earth": {
    "spacecraft_distance_km": 1520000,
    "delay_s": 2111.1,
    "delay_quality": "measured",
    "arriving_now_measured_at": "2026-06-12T08:39:11Z"
  },
  "indices": {
    "kp": { "value": 7.33, "measured_at": "2026-06-12T08:00:00Z" },
    "kp_forecast": [
      { "valid_at": "2026-06-12T09:00:00Z", "value": 7.67 },
      { "valid_at": "2026-06-12T12:00:00Z", "value": 6.33 }
    ],
    "dst_nt": { "value": -142, "measured_at": "2026-06-12T07:00:00Z" },
    "f107": { "value": 182.5, "measured_at": "2026-06-11T20:00:00Z" },
    "noaa_scales": { "R": "R1", "S": null, "G": "G3" }
  },
  "ovation": {
    "observation_time": "2026-06-12T08:00:00Z",
    "forecast_time": "2026-06-12T08:30:00Z",
    "grid_r2_key": "v1/ovation/latest.json",
    "hemispheric_power_gw": 95.3
  },
  "alerts": [
    { "issued_at": "2026-06-12T07:42:00Z", "code": "ALTK07", "title": "Geomagnetic K-index of 7 reached" }
  ],
  "events_active": ["2026-06-04T07:31Z-CME-001"]
}
