{
  "schema_version": "1.0.0",
  "generated_at": "2026-06-12T08:05:00Z",
  "cadence_s": 300,
  "clocks": {
    "sun_imagery_at": "2026-06-12T07:49:00Z",
    "l1_measured_at": "2026-06-12T06:49:00Z",
    "model_run_at": "2026-06-12T06:00:00Z"
  },
  "sources": {
    "swpc_plasma": { "status": "stale", "last_success_at": "2026-06-12T06:49:00Z", "age_s": 4560 },
    "swpc_mag": { "status": "ok", "last_success_at": "2026-06-12T08:04:30Z", "age_s": 30 },
    "swpc_indices": { "status": "ok", "last_success_at": "2026-06-12T08:00:10Z", "age_s": 290 },
    "ovation": { "status": "ok", "last_success_at": "2026-06-12T08:01:00Z", "age_s": 240 },
    "donki": { "status": "gap", "last_success_at": null, "age_s": null },
    "goes_csm": { "status": "ok", "last_success_at": "2026-06-12T07:55:00Z", "age_s": 600 },
    "sdo_imagery": { "status": "ok", "last_success_at": "2026-06-12T07:49:00Z", "age_s": 960 }
  },
  "solar_wind": {
    "measured_at": "2026-06-12T06:49:00Z",
    "spacecraft": "ACE",
    "speed_kms": 385.0,
    "density_pcc": 3.8,
    "temperature_k": 79000,
    "bt_nt": 4.8,
    "bx_gsm_nt": 0.9,
    "by_gsm_nt": -1.6,
    "bz_gsm_nt": 1.4,
    "series": {
      "t_unix": [1781243340, 1781243640, 1781243940, 1781244240, 1781244540, 1781244840],
      "speed_kms": [388.0, 386.5, null, null, 384.0, 385.0],
      "bz_gsm_nt": [1.2, 1.6, null, null, 1.5, 1.4],
      "density_pcc": [3.9, 3.8, null, null, 3.7, 3.8]
    }
  },
  "l1_to_earth": {
    "spacecraft_distance_km": 1503000,
    "delay_s": 1800,
    "delay_quality": "degraded_fixed",
    "arriving_now_measured_at": "2026-06-12T07:19:00Z"
  },
  "indices": {
    "kp": { "value": 2.0, "measured_at": "2026-06-12T08:00:00Z" },
    "dst_nt": { "value": -5, "measured_at": "2026-06-12T07:00:00Z" },
    "f107": { "value": 148.2, "measured_at": "2026-06-11T20:00:00Z" },
    "noaa_scales": { "R": null, "S": null, "G": null }
  },
  "ovation": {
    "observation_time": "2026-06-12T08:00:00Z",
    "forecast_time": "2026-06-12T08:30:00Z",
    "grid_r2_key": "v1/ovation/latest.json",
    "hemispheric_power_gw": 10.1
  },
  "alerts": [],
  "events_active": []
}
